<?xml version="1.0" encoding="UTF-8"?>
<!DOCTYPE cd SYSTEM "cd.dtd">

<cd titulo="Titulo">
    <fecha dia="2" mes="2" anio="2008" />
    <canciones>
        <cancion duracion="4:47" anio="2008" precio="0.99">
            <titulo>Give it 2 me</titulo>
            <compositores>
                <compositor>
                    <nombres>Pharrell</nombres>
                    <apellidos>Williams</apellidos>
                </compositor>
            </compositores>
            <productores>
                <productor>
                    <nombres>Pharrell</nombres>
                    <apellidos>Williams</apellidos>
                </productor>
            </productores>
            <sello>Warner Bros. Records</sello>
            <artista>Madonna</artista>
        </cancion>
    </canciones>
</cd>